{
  "schema": 1,
  "title": "Critter Trap",
  "subtitle": "Building",
  "source": "mod-export",
  "asOf": "2026-01-01T12:00:00Z",
  "nav": {
    "back": "home"
  },
  "refreshOn": [
    "gamedata",
    "build",
    "colony"
  ],
  "blocks": [
    {
      "type": "chips",
      "chips": [
        {
          "label": "Base game",
          "style": "dlc"
        }
      ]
    },
    {
      "type": "text",
      "spans": [
        {
          "type": "plain",
          "text": "Made-up."
        }
      ]
    },
    {
      "type": "text",
      "spans": [
        {
          "type": "plain",
          "text": "Catches made-up critters."
        }
      ]
    },
    {
      "type": "picker",
      "title": "Build with",
      "slots": [
        {
          "label": "Metal",
          "needKg": 100,
          "options": [
            {
              "id": "SynthMetalA",
              "name": "Metal A",
              "needKg": 100,
              "haveKg": 1240,
              "enabled": true,
              "selected": true
            },
            {
              "id": "SynthMetalB",
              "name": "Metal B",
              "needKg": 100,
              "haveKg": 80,
              "enabled": false,
              "selected": false
            },
            {
              "id": "SynthMetalC",
              "name": "Metal C",
              "needKg": 100,
              "haveKg": 0,
              "enabled": false,
              "selected": false
            }
          ]
        },
        {
          "label": "Plastic",
          "needKg": 50,
          "options": [
            {
              "id": "SynthPlastic",
              "name": "Plastic",
              "needKg": 50,
              "haveKg": 30,
              "enabled": false,
              "selected": true
            }
          ]
        }
      ],
      "action": {
        "id": "build_select",
        "label": "Build",
        "args": {
          "buildingId": "SynthTrap"
        }
      }
    },
    {
      "type": "stats",
      "title": "Basics",
      "rows": [
        {
          "label": "Build menu",
          "value": "Automation"
        },
        {
          "label": "Size",
          "value": "1 x 2",
          "unit": "tiles"
        },
        {
          "label": "Hit points",
          "value": 30
        },
        {
          "label": "Build time",
          "value": 10,
          "unit": "s"
        }
      ]
    },
    {
      "type": "group",
      "title": "Automation",
      "blocks": [
        {
          "type": "text",
          "spans": [
            {
              "type": "bold",
              "text": "Trap Status"
            },
            {
              "type": "plain",
              "text": "\nReports whether a critter is inside."
            }
          ]
        },
        {
          "type": "text",
          "spans": [
            {
              "type": "plain",
              "text": "Green signal: Sends a green signal when a critter is inside.",
              "color": "positive"
            }
          ]
        },
        {
          "type": "text",
          "spans": [
            {
              "type": "plain",
              "text": "Red signal: Sends a red signal when the trap is empty.",
              "color": "negative"
            }
          ]
        },
        {
          "type": "text",
          "spans": [
            {
              "type": "bold",
              "text": "Trap Control"
            }
          ]
        },
        {
          "type": "text",
          "spans": [
            {
              "type": "plain",
              "text": "Green signal: Arms the trap.",
              "color": "positive"
            }
          ]
        },
        {
          "type": "text",
          "spans": [
            {
              "type": "plain",
              "text": "Red signal: Disarms the trap.",
              "color": "negative"
            }
          ]
        }
      ]
    },
    {
      "type": "group",
      "title": "Research",
      "blocks": [
        {
          "type": "list",
          "items": [
            {
              "ref": {
                "kind": "tech",
                "id": "SynthSensing"
              },
              "title": "Sensing",
              "subtitle": "30 Basic Research, 10 Advanced Research"
            }
          ]
        }
      ]
    },
    {
      "type": "link",
      "label": "Open on the ONI wiki",
      "url": "https://oxygennotincluded.wiki.gg/wiki/Critter_Trap"
    }
  ]
}
